id,title,question_url,subdomain,type,num_boundaries_open,low_open,high_open,p_outside,question_scale_low,question_scale_high,anon_prediction_count,last_activity_time,votes,comment_count,created_time,publish_time,close_time,resolve_time,author_name,last_read,has_predictions,activity,title_short
917,Will a space elevator successfully be built by 2100?,https://www.metaculus.com/questions/917,www,BinaryQuestion,,,,,,,,2020-06-22T11:30:30.805363Z,25,18,2018-05-18T22:01:40.493863Z,2018-05-21 07:00:00.000,2031-04-15 07:00:00,2100-01-01 08:00:00,,,,0.00000000092404653315,Will a space elevator successfully be bu
899,Will the world's richest person in 2033 have a net worth greater than that of John D. Rockefeller in 1913?,https://www.metaculus.com/questions/899,www,BinaryQuestion,,,,,,,,2020-06-19T20:53:07.533596Z,9,18,2018-05-10T18:21:13.394909Z,2018-05-15 07:00:00.000,2022-01-01 00:00:00,2033-01-01 00:00:00,,,,0.00000000008377326084,Will the world's richest person in 2033 
841,Will Metaculus exist in 2030?,https://www.metaculus.com/questions/841,www,BinaryQuestion,,,,,,,,2020-06-24T07:42:36.217374Z,23,35,2018-04-28T19:23:54.632250Z,2018-04-29 07:00:00.000,2026-01-01 00:00:00,2030-01-01 00:00:00,,,,0.00000001450928875277,Will Metaculus exist in 2030?
824,Will a practical nuclear fusion reactor first be developed in China?,https://www.metaculus.com/questions/824,www,BinaryQuestion,,,,,,,,2020-06-18T07:48:43.680018Z,16,21,2018-04-21T21:43:28.350874Z,2018-04-24 07:00:00.000,2025-01-01 08:00:00,2050-01-01 08:00:00,,,,0.00000000004445295615,Will a practical nuclear fusion reactor 
808,"Will Europa be the first place humanity will discover extraterrestrial life, if it is discovered by 2045?",https://www.metaculus.com/questions/808,www,BinaryQuestion,,,,,,,,2020-06-25T08:39:59.671415Z,22,21,2018-04-18T19:03:26.247870Z,2018-04-21 07:00:00.000,2025-01-01 08:00:00,2045-01-01 08:00:00,,,,3.65222602441679189411,Will Europa be the first place humanity 
797,Will Puerto Rico become a US state prior to 2035?,https://www.metaculus.com/questions/797,www,BinaryQuestion,,,,,,,,2020-06-23T04:09:37.995644Z,23,12,2018-04-14T17:54:15.255599Z,2018-04-17 07:00:00.000,2025-01-01 08:00:00,2035-01-01 08:00:00,,,,0.04825480781375800915,Will Puerto Rico become a US state prior
736,"Will there be a complete 4 year interval in which world output doubles, before the first 1 year interval in which world output doubles?",https://www.metaculus.com/questions/736,www,BinaryQuestion,,,,,,,,2020-06-21T18:12:45.917137Z,23,12,2018-03-25T15:31:09.102582Z,2018-03-29 07:00:00.000,2030-01-01 00:00:00,2050-01-01 00:00:00,,,,0.00000000327946741628,Will there be a complete 4 year interval
737,Will SpaceX land anything on Mars by 2030?,https://www.metaculus.com/questions/737,www,BinaryQuestion,,,,,,,,2020-06-25T05:01:50.256221Z,100,40,2018-03-26T09:36:11.361975Z,2018-03-29 07:00:00.000,2024-08-01 09:32:00,2030-01-01 10:35:00,,,,0.00000008633002589192,Will SpaceX land anything on Mars by 203
735,When will there be a mile-high building?,https://www.metaculus.com/questions/735,www,LinearDateQuestion,0.00000000000000000000,False,False,0.00000000000000000000,2019-03-21,2060-03-20,,2020-06-22T11:32:26.830519Z,9,15,2018-03-25T13:42:45.869604Z,2018-03-28 07:00:00.000,2024-12-15 08:00:00,2060-01-01 08:00:00,,,True,0.00000000092488132974,When will there be a mile-high building?
684,By 2025 will someone be able to hold his/her breath for 30+ minutes?,https://www.metaculus.com/questions/684,www,BinaryQuestion,,,,,,,,2020-06-12T13:26:46.372826Z,10,4,2018-03-16T15:05:06.256428Z,2018-03-19 07:00:00.000,2025-01-01 08:00:00,2050-01-01 08:00:00,,,,0.00000000000022222318,By 2025 will someone be able to hold his
686,Will a human made spaceship enter the Venusian atmosphere before 2030?,https://www.metaculus.com/questions/686,www,BinaryQuestion,,,,,,,,2020-06-15T13:55:51.376258Z,23,13,2018-03-16T15:14:08.172454Z,2018-03-19 07:00:00.000,2022-01-01 08:00:00,2030-03-01 08:00:00,,,,0.00000000000097227238,Will a human made spaceship enter the Ve
665,Kessler syndrome by 2050?,https://www.metaculus.com/questions/665,www,BinaryQuestion,,,,,,,,2020-06-24T09:03:06.762205Z,19,29,2018-02-24T19:04:30.197420Z,2018-02-27 08:00:00.000,2030-01-01 00:00:00,2050-01-01 00:00:00,,,,0.00000003444933741706,Kessler syndrome by 2050?
658,Will we reach the island of stability by 2050?,https://www.metaculus.com/questions/658,www,BinaryQuestion,,,,,,,,2020-05-25T16:11:41.647446Z,15,4,2018-02-23T17:53:25.304447Z,2018-02-26 08:00:00.000,2030-01-01 00:00:00,2050-01-01 00:00:00,,,,0.00000000000000000000,Will we reach the island of stability by
600,Will a sample of negative energy be produced by 2100?,https://www.metaculus.com/questions/600,www,BinaryQuestion,,,,,,,,2020-06-10T15:06:56.233877Z,14,3,2017-12-06T00:11:47.195958Z,2018-01-29 08:00:00.000,2025-01-15 08:00:00,2100-01-01 08:00:00,,,,0.00000000000000006686,Will a sample of negative energy be prod
614,Will there be a Vegan Country by 2100?,https://www.metaculus.com/questions/614,www,BinaryQuestion,,,,,,,,2020-06-13T20:43:37.714334Z,19,17,2018-01-02T17:44:28.910640Z,2018-01-25 05:00:00.000,2025-01-01 00:00:00,2100-01-01 00:00:00,,,,0.00000000000000590565,Will there be a Vegan Country by 2100?
610,Will our current peace be shorter than the Pax Romana?,https://www.metaculus.com/questions/610,www,BinaryQuestion,,,,,,,,2020-06-17T20:38:30.510332Z,30,7,2017-12-25T17:30:30.774903Z,2017-12-29 08:00:00.000,2030-01-01 00:00:00,2161-01-01 00:00:00,,,,0.00000000000699993793,Will our current peace be shorter than t
606,Answer to signal broadcast into space by 2045?,https://www.metaculus.com/questions/606,www,BinaryQuestion,,,,,,,,2020-05-17T13:05:37.236788Z,14,12,2017-12-15T14:35:39.116930Z,2017-12-21 08:00:00.000,2025-12-31 07:00:00,2045-12-31 07:00:00,,,,0.00000000000000000000,Answer to signal broadcast into space by
605,How much global warming by 2100?,https://www.metaculus.com/questions/605,www,LinearQuestion,0.00000000000000000000,False,False,0.00000000000000000000,0,10,,2020-06-25T00:02:07.702053Z,33,41,2017-12-12T08:17:48.400726Z,2017-12-21 08:00:00.000,2030-01-01 00:00:00,2100-01-01 00:00:00,,,True,0.21998213933274959886,How much global warming by 2100?
604,Will gravitational waves from the merger of supermassive black holes be detected within the next 10 years?,https://www.metaculus.com/questions/604,www,BinaryQuestion,,,,,,,,2020-06-20T00:17:09.748440Z,12,15,2017-12-11T15:19:57.278406Z,2017-12-21 08:00:00.000,2020-11-30 07:00:00,2027-11-30 07:00:00,,,,0.00000000028252625067,Will gravitational waves from the merger
594,Increased off-world population in 2050?,https://www.metaculus.com/questions/594,www,BinaryQuestion,,,,,,,,2020-06-25T11:00:45.454907Z,39,14,2017-11-26T15:06:11.650859Z,2017-11-30 08:00:00.000,2025-12-30 17:00:00,2051-01-01 17:00:00,,,,0.00000013928718629774,Increased off-world population in 2050?
587,World Population in 2050?,https://www.metaculus.com/questions/587,www,LogQuestion,0.00000000000000000000,False,False,0.00000000000000000000,7000000000.0,15000000000.0,,2020-06-21T17:11:48.787637Z,19,12,2017-11-20T07:59:00.713120Z,2017-11-23 08:00:00.000,2025-12-31 00:00:00,2051-01-10 00:00:00,,,True,0.00000000723021222644,World Population in 2050?
570,A major United States earthquake by 2023?,https://www.metaculus.com/questions/570,www,BinaryQuestion,,,,,,,,2020-06-24T21:10:47.734453Z,16,33,2017-10-09T13:59:51.327368Z,2017-11-21 08:00:00.000,2021-04-15 06:00:00,2021-04-15 06:00:00,,,,0.54031317324416938686,A major United States earthquake by 2023
585,2˚C global warming by 2100?,https://www.metaculus.com/questions/585,www,BinaryQuestion,,,,,,,,2020-06-21T18:39:44.517390Z,24,2,2017-11-17T15:28:13.455800Z,2017-11-21 08:00:00.000,2030-01-01 00:00:00,2100-06-14 23:00:00,,,,0.00000000104834038382,2˚C global warming by 2100?
579,Will VR or AR Headsets dominate by 2025?,https://www.metaculus.com/questions/579,www,BinaryQuestion,,,,,,,,2020-06-19T18:12:40.772020Z,11,3,2017-11-09T14:42:40.245970Z,2017-11-14 08:00:00.000,2025-10-31 06:00:00,2026-07-31 06:00:00,,,,0.00000000015954051586,Will VR or AR Headsets dominate by 2025?
578,Will humans go extinct by 2100?,https://www.metaculus.com/questions/578,www,BinaryQuestion,,,,,,,,2020-06-25T06:06:58.022830Z,20,35,2017-11-07T08:26:49.817900Z,2017-11-12 08:00:00.000,2030-02-09 00:00:00,2100-01-01 00:00:00,,,,0.00000005244950290295,Will humans go extinct by 2100?
523,Resolution of the Density Conjecture for Newton's N-body problem,https://www.metaculus.com/questions/523,www,BinaryQuestion,,,,,,,,2020-06-05T01:35:03.858679Z,10,16,2017-08-23T14:09:03.312413Z,2017-08-28 12:00:00.000,2020-08-30 12:00:00,2027-08-30 12:00:00,,,,0.00000000000000000008,Resolution of the Density Conjecture for
512,Will an AI system do credibly well on a full math SAT exam by 2025?,https://www.metaculus.com/questions/512,www,BinaryQuestion,,,,,,,,2020-06-15T02:38:26.699641Z,29,15,2017-08-12T00:03:03.281828Z,2017-08-14 07:00:00.000,2021-03-15 07:00:00,2026-01-01 08:00:00,,,,0.00000000000052599900,Will an AI system do credibly well on a 
513,Will the first commercial hyperloop system be within the US?,https://www.metaculus.com/questions/513,www,BinaryQuestion,,,,,,,,2020-06-01T09:24:36.386746Z,15,9,2017-08-12T00:08:50.143230Z,2017-08-14 07:00:00.000,2025-06-15 07:00:00,2035-01-01 08:00:00,,,,0.00000000000000000000,Will the first commercial hyperloop syst
504,How many subscribers will Netflix have by August 2022?,https://www.metaculus.com/questions/504,www,LogQuestion,0.00000000000000000000,False,False,0.00000000000000000000,100000000,500000000,,2020-06-24T12:20:09.126655Z,18,19,2017-08-04T08:19:31.050302Z,2017-08-07 07:00:00.000,2020-07-18 00:00:00,2022-10-02 00:00:00,,,True,0.00000003979257624539,How many subscribers will Netflix have b
492,"With an international nuclear weapons ban in place, will a country that has nuclear weapons actually give them up by 2035?",https://www.metaculus.com/questions/492,www,BinaryQuestion,,,,,,,,2020-06-25T16:15:00.801141Z,8,3,2017-07-14T22:00:41.662816Z,2017-07-19 07:00:00.000,2025-06-15 07:00:00,2035-01-01 08:00:00,,,,0.00000007920302015810,With an international nuclear weapons ba
491,Will China achieve its Paris Climate Agreement goals?,https://www.metaculus.com/questions/491,www,BinaryQuestion,,,,,,,,2020-06-15T13:41:57.650013Z,23,6,2017-07-14T21:57:48.248216Z,2017-07-17 07:00:00.000,2025-06-15 07:00:00,2030-01-01 08:00:00,,,,0.00000000000030014198,Will China achieve its Paris Climate Agr
489,Will the European Union meet its 2030 targets under the Paris Climate Treaty?,https://www.metaculus.com/questions/489,www,BinaryQuestion,,,,,,,,2020-06-04T16:26:35.515128Z,17,9,2017-07-09T19:03:41.928736Z,2017-07-12 07:00:00.000,2025-03-15 07:00:00,2030-01-01 08:00:00,,,,0.00000000000000000002,Will the European Union meet its 2030 ta
477,Efficacy confirmation of a new Alzheimer's treatment protocol?,https://www.metaculus.com/questions/477,www,BinaryQuestion,,,,,,,,2020-06-25T06:27:26.064724Z,12,5,2017-06-09T21:22:12.186653Z,2017-06-12 21:21:04.000,2021-01-01 00:00:00,2025-01-01 00:00:00,,,,0.00000007367015570176,Efficacy confirmation of a new Alzheimer
455,"If you die today and get cryonically frozen, will you ""wake up""?",https://www.metaculus.com/questions/455,www,BinaryQuestion,,,,,,,,2020-06-22T01:41:50.871848Z,29,17,2017-03-29T21:05:44.948070Z,2017-03-29 20:50:00.000,2030-01-01 21:50:00,2060-01-01 21:50:03.400000,,,,0.00000000406140558878,If you die today and get cryonically fro
397,Robocup Challenge,https://www.metaculus.com/questions/397,www,BinaryQuestion,,,,,,,,2020-06-15T13:47:01.604908Z,16,8,2016-12-09T23:45:21.010136Z,2016-12-10 23:44:04.900,2030-01-01 23:45:00.100000,2050-12-31 23:45:00.800000,,,,0.00000000000043564925,Robocup Challenge
384,Human-machine intelligence parity by 2040?,https://www.metaculus.com/questions/384,www,BinaryQuestion,,,,,,,,2020-06-24T23:29:50.063354Z,95,37,2016-11-25T18:38:09.919659Z,2016-12-01 18:36:02.900,2036-01-01 00:00:00,2040-01-01 00:00:00,,,,0.00000003758258386764,Human-machine intelligence parity by 204
375,The end of the EU as we know it by 2026?,https://www.metaculus.com/questions/375,www,BinaryQuestion,,,,,,,,2020-06-19T17:36:03.035695Z,48,15,2016-11-12T23:52:13.323008Z,2016-11-15 19:46:05.700,2021-12-31 23:59:00,2027-01-31 23:59:00,,,,0.00000000048012990400,The end of the EU as we know it by 2026?
372,Will human brain emulation be the first successful route to human-level digital intelligence?,https://www.metaculus.com/questions/372,www,BinaryQuestion,,,,,,,,2020-06-22T18:06:05.716930Z,28,6,2016-11-05T20:12:32.539395Z,2016-11-06 21:09:01.600,2030-01-01 00:00:00,2060-01-01 00:00:00,,,,0.00000000354177805132,Will human brain emulation be the first 
353,Will someone born before 2001 live to be 150?,https://www.metaculus.com/questions/353,www,BinaryQuestion,,,,,,,,2020-06-24T23:34:02.436622Z,52,29,2016-10-18T15:09:09.013820Z,2016-10-18 15:13:04.500,2049-10-19 00:00:00,2159-01-01 00:00:00,,,,0.00000006213938422627,Will someone born before 2001 live to be
349,Will SpaceX land people on Mars prior to 2030?,https://www.metaculus.com/questions/349,www,BinaryQuestion,,,,,,,,2020-06-25T16:24:12.711265Z,751,359,2016-10-12T22:19:53.161006Z,2016-10-13 15:39:03.200,2020-10-12 22:19:03.700000,2030-10-12 12:00:00,,,,13.78212510739042961916,Will SpaceX land people on Mars prior to
161,Will the Universe end?,https://www.metaculus.com/questions/161,www,BinaryQuestion,,,,,,,,2020-06-22T18:08:00.159640Z,17,33,2016-03-01T04:01:37.526700Z,2016-03-01 17:29:01.400,2026-01-01 00:00:00,9999-12-31 00:00:00,,,,0.00000000134290816868,Will the Universe end?
4685,How many cases of end-stage renal disease will there be in the U.S. in 2021?,https://pandemic.metaculus.com/questions/4685,pandemic,LinearQuestion,1.00000000000000000000,False,True,0.01000000000000000888,0,2000000,0.00000000000000000000,2020-06-23T02:48:40.302801Z,2,2,2020-06-20T13:48:10.297263Z,2020-06-21 00:00:00.000,2020-12-31 17:00:00,2024-12-31 17:00:00,juancambeiro,,True,0.04212310532322299100,How many cases of end-stage renal diseas
4648,What mean percentage of students will be served by counseling services in US baccalaureate institutions in the school year 2020-2021?,https://pandemic.metaculus.com/questions/4648,pandemic,LinearQuestion,1.00000000000000000000,False,True,0.02193999999999995953,0,25,0.00000000000000000000,2020-06-19T16:22:39.327112Z,1,0,2020-06-14T20:34:39.292144Z,2020-06-16 22:00:00.000,2021-06-30 07:00:00,2022-06-30 07:00:00,AlyssaStevens,,True,0.00000540816523173564,What mean percentage of students will be
4649,What percentage of recent college graduates will be unemployed in the first and second quarters of 2021?,https://pandemic.metaculus.com/questions/4649,pandemic,LinearQuestion,1.00000000000000000000,False,True,0.06903999999999999027,0,10,1.00000000000000000000,2020-06-25T01:05:35.535730Z,3,0,2020-06-14T20:35:31.691833Z,2020-06-16 22:00:00.000,2021-04-30 07:00:00,2021-11-01 07:00:00,AlyssaStevens,,True,0.00000552897562394439,What percentage of recent college gradua
4646,What will total enrollment for recent US high school graduates be in US colleges in 2021?,https://pandemic.metaculus.com/questions/4646,pandemic,LinearQuestion,2.00000000000000000000,True,True,0.03435999999999997390,1000000,4000000,0.00000000000000000000,2020-06-21T09:25:24.862229Z,2,0,2020-06-14T20:23:13.564716Z,2020-06-16 22:00:00.000,2021-07-29 22:00:00,2022-08-31 22:00:00,AlyssaStevens,,True,0.00133184885247777354,What will total enrollment for recent US
4647,How much money will the federal government spend in millions on student loans in the 2020-2021 school year?,https://pandemic.metaculus.com/questions/4647,pandemic,LinearQuestion,2.00000000000000000000,True,True,0.06894000000000004291,75000,250000,0.00000000000000000000,2020-06-19T16:19:50.500607Z,1,0,2020-06-14T20:31:37.906469Z,2020-06-16 22:00:00.000,2021-04-30 07:00:00,2022-06-01 07:00:00,AlyssaStevens,,True,0.00000539234819888749,How much money will the federal governme
4596,What will the percentage difference between full time tenure-track and non-tenure track employment in US baccalaureate institutions be in the 2020-2021 school year?,https://pandemic.metaculus.com/questions/4596,pandemic,LinearQuestion,2.00000000000000000000,True,True,0.02958000000000002294,-15,15,0.00000000000000000000,2020-06-21T09:30:10.537675Z,1,2,2020-06-04T22:13:19.855024Z,2020-06-16 22:00:00.000,2021-01-01 08:00:00,2021-06-01 07:00:00,AlyssaStevens,,True,0.00000080059968774919,What will the percentage difference betw
4595,Will the nominal salaries of tenured professors in the US decrease in the school year 2020-2021 from reported salaries in 2019-2020?,https://pandemic.metaculus.com/questions/4595,pandemic,BinaryQuestion,,,,,,,,2020-06-25T03:43:45.768273Z,1,0,2020-06-04T19:42:57.863756Z,2020-06-15 22:00:00.000,2021-05-30 07:00:00,2022-06-01 07:00:00,,,,0.00000011812213235521,Will the nominal salaries of tenured pro
4594,What will the Cohort College Participation Rates (%) for the lowest family income quartile for dependent 18-to 24-year-olds be in 2021?,https://pandemic.metaculus.com/questions/4594,pandemic,LinearQuestion,2.00000000000000000000,True,True,0.03052999999999998423,10,85,0.00000000000000000000,2020-06-21T09:32:11.211436Z,0,0,2020-06-04T19:37:16.449165Z,2020-06-14 22:00:00.000,2021-10-12 07:00:00,2023-06-12 07:00:00,AlyssaStevens,2020-06-23T00:13:39.472583Z,True,0.00000006404057681572,What will the Cohort College Participati
4598,What will the percent difference for inflation-adjusted tuition between public  and private universities and colleges be in the 2020-2021?,https://pandemic.metaculus.com/questions/4598,pandemic,LinearQuestion,2.00000000000000000000,True,True,0.10139000000000003565,-6,4,0.00000000000000000000,2020-06-19T16:24:54.846593Z,2,5,2020-06-04T22:27:55.706090Z,2020-06-14 22:00:00.000,2021-08-12 07:00:00,2022-01-01 08:00:00,AlyssaStevens,,True,0.00017303359101855341,What will the percent difference for inf
4455,What will be the U.S. age-adjusted stroke death rate in 2021?,https://pandemic.metaculus.com/questions/4455,pandemic,LinearQuestion,1.00000000000000000000,False,True,0.01304000000000005155,0,150,0.00000000000000000000,2020-06-18T17:30:09.054422Z,2,7,2020-05-22T21:27:41.537047Z,2020-06-12 16:00:00.000,2021-12-31 17:00:00,2024-12-31 17:00:00,randallburns,,True,0.00029750041645454779,What will be the U.S. age-adjusted strok
4602,What will state expenditure from state and local tax revenue on higher education per capita be in 2021?,https://pandemic.metaculus.com/questions/4602,pandemic,LinearQuestion,2.00000000000000000000,True,True,0.09601999999999995261,290,400,0.00000000000000000000,2020-06-16T14:23:15.054969Z,1,0,2020-06-04T23:13:06.824855Z,2020-06-11 22:00:00.000,2020-08-30 07:00:00,2022-06-01 07:00:00,AlyssaStevens,,True,0.00000000292966629915,What will state expenditure from state a
4601,"If the current political presidential administration is elected in November of 2020, will all public schools (post-secondary and lower) be open by January 2021?",https://pandemic.metaculus.com/questions/4601,pandemic,BinaryQuestion,,,,,,,,2020-06-19T04:49:12.433247Z,1,4,2020-06-04T23:07:12.217703Z,2020-06-11 22:00:00.000,2020-11-01 07:00:00,2021-01-31 08:00:00,,,,0.00000588793341189071,If the current political presidential ad
4603,"What will the US Q3 2020 GDP growth rate be, according to the US Bureau of Economic Analysis Advance Estimate?",https://pandemic.metaculus.com/questions/4603,pandemic,LinearQuestion,2.00000000000000000000,True,True,0.07484999999999997211,-20,20,0.00000000000000000000,2020-06-25T00:01:52.909683Z,6,17,2020-06-05T02:37:40.908628Z,2020-06-11 00:00:04.000,2020-10-02 00:00:00,2020-10-30 00:00:00,Jgalt,2020-06-15T04:04:13.961143Z,True,2.17058932689951067374,What will the US Q3 2020 GDP growth rate
4508,How many EU countries will (re)-introduce mandatory social distancing measures between July and the end of 2020?,https://pandemic.metaculus.com/questions/4508,pandemic,LinearQuestion,0.00000000000000000000,False,False,0.00000000000000000000,0,27,,2020-06-25T17:58:47.870321Z,3,5,2020-05-27T22:57:54.686448Z,2020-06-10 04:00:00.000,2020-07-01 00:00:00,2021-01-02 00:00:00,,,True,0.00000108334603496326,How many EU countries will (re)-introduc
4120,How will Sweden and Finland's relative HDI change after COVID-19 by 2025?,https://pandemic.metaculus.com/questions/4120,pandemic,LinearQuestion,2.00000000000000000000,True,True,0.02174999999999998462,0.8,1.2,0.00000000000000000000,2020-06-18T01:36:21.462665Z,2,14,2020-04-13T07:28:32.645807Z,2020-06-06 04:00:00.000,2021-03-13 08:27:00,2025-11-13 08:27:00,randallburns,,True,0.00000000002490051901,How will Sweden and Finland's relative H
4259,What will be the ratio of COVID-19 deaths per capita between Sweden and Finland be for 2021?,https://pandemic.metaculus.com/questions/4259,pandemic,LinearQuestion,2.00000000000000000000,True,True,0.64039000000000001478,0.6,1.6,0.00000000000000000000,2020-06-14T03:35:21.828633Z,6,8,2020-04-24T20:15:49.216053Z,2020-06-06 04:00:00.000,2020-08-30 20:13:00,2022-04-24 20:13:00,randallburns,,True,0.00000000000121467383,What will be the ratio of COVID-19 death
4303,How will Sweden and Finland's relative Fragile State Index change after COVID-19 by 2025?,https://pandemic.metaculus.com/questions/4303,pandemic,LinearQuestion,2.00000000000000000000,True,True,0.04282999999999998614,0.8,1.4,0.00000000000000000000,2020-06-18T01:35:12.614454Z,2,5,2020-04-30T06:32:21.962909Z,2020-06-06 04:00:00.000,2020-08-30 06:31:00,2026-01-29 07:31:00,randallburns,,True,0.00000000047288541911,How will Sweden and Finland's relative F
4572,How much transit activity will there be in the San Francisco Bay Area in the last week of July?,https://pandemic.metaculus.com/questions/4572,pandemic,LinearQuestion,2.00000000000000000000,True,True,0.02663000000000000783,10,150,0.00000000000000000000,2020-06-24T15:01:55.840620Z,6,0,2020-06-02T19:58:34.963755Z,2020-06-05 04:00:00.000,2020-07-25 03:59:00,2020-08-05 03:59:00,ought,,True,0.00000004645072071865,How much transit activity will there be 
4573,How much transit activity will there be in the San Francisco Bay Area in the last week of August?,https://pandemic.metaculus.com/questions/4573,pandemic,LinearQuestion,2.00000000000000000000,True,True,0.02672000000000000763,10,150,0.00000000000000000000,2020-06-24T15:03:12.496411Z,7,0,2020-06-02T20:01:20.748927Z,2020-06-05 04:00:00.000,2020-08-22 03:59:00,2020-09-02 03:59:00,ought,,True,0.00000002174701837243,How much transit activity will there be 
4568,How much transit activity will there be in New York City in the last week of July?,https://pandemic.metaculus.com/questions/4568,pandemic,LinearQuestion,2.00000000000000000000,True,True,0.02663999999999999008,10,150,0.00000000000000000000,2020-06-25T00:01:31.474900Z,7,1,2020-06-02T19:22:24.479273Z,2020-06-05 04:00:00.000,2020-07-25 03:59:00,2020-08-05 03:59:00,ought,2020-06-12T18:17:45.434731Z,True,0.00000015680284201517,How much transit activity will there be 
4568,How much transit activity will there be in New York City in the last week of July?,https://pandemic.metaculus.com/questions/4568,pandemic,LinearQuestion,2.00000000000000000000,True,True,0.02663999999999999008,10,150,0.00000000000000000000,2020-06-25T00:01:31.474900Z,7,1,2020-06-02T19:22:24.479273Z,2020-06-05 04:00:00.000,2020-07-25 03:59:00,2020-08-05 03:59:00,ought,2020-06-12T18:17:45.434731Z,True,0.00000015680220024713,How much transit activity will there be 
4569,How much transit activity will there be in New York City in the last week of August?,https://pandemic.metaculus.com/questions/4569,pandemic,LinearQuestion,2.00000000000000000000,True,True,0.02623000000000003801,10,150,0.00000000000000000000,2020-06-25T00:01:38.797237Z,8,0,2020-06-02T19:39:25.464761Z,2020-06-05 04:00:00.000,2020-08-22 03:59:00,2020-09-02 03:59:00,ought,2020-06-09T17:59:46.671340Z,True,0.00000014031744165589,How much transit activity will there be 
4570,How much transit activity will there be in New York City in the last week of September?,https://pandemic.metaculus.com/questions/4570,pandemic,LinearQuestion,2.00000000000000000000,True,True,0.02794999999999997833,10,150,0.00000000000000000000,2020-06-25T00:01:45.175319Z,8,0,2020-06-02T19:42:20.964042Z,2020-06-05 04:00:00.000,2020-09-19 03:59:00,2020-09-30 03:59:00,ought,2020-06-18T01:43:20.003511Z,True,0.00000049738316960959,How much transit activity will there be 
4432,When will U.S. tech workers return to the office?,https://pandemic.metaculus.com/questions/4432,pandemic,LinearDateQuestion,1.00000000000000000000,False,True,0.32442000000000004167,2020-05-10,2024-05-10,0.00000000000000000000,2020-06-14T03:18:24.275520Z,4,10,2020-05-18T04:38:27.783113Z,2020-06-03 06:00:00.000,2020-12-31 20:00:00,2024-05-17 19:00:00,krtnu,,True,0.00000000000002661627,When will U.S. tech workers return to th
4536,Will the US see widespread rioting in 2020?,https://pandemic.metaculus.com/questions/4536,pandemic,BinaryQuestion,,,,,,,,2020-06-23T21:27:32.271251Z,15,25,2020-06-01T00:53:59.462059Z,2020-06-01 03:00:05.900,2020-08-30 23:00:00,2021-01-02 00:00:00,,,,0.05316058220208327162,Large scale rioting in US in 2020?
4420,"When will the U.S. code ""National All-Hazards Preparedness for Public Health Emergencies"" next be amended?",https://pandemic.metaculus.com/questions/4420,pandemic,LinearDateQuestion,1.00000000000000000000,False,True,0.17245999999999994667,2020-05-17,2021-08-19,0.00000000000000000000,2020-06-20T07:22:47.722042Z,1,2,2020-05-16T22:10:09.444758Z,2020-05-22 22:00:00.000,2020-07-31 22:00:00,2022-12-31 23:00:00,Tamay,,True,0.00000000022933735456,"When will the U.S. code ""National All-Ha"
